{
  "standardVersion": "3.0.0",
  "toolVersion": "design-lab 0.22.0",
  "generatedAt": "2026-10-06T20:23:38+00:00",
  "source": {
    "ddevProject": null,
    "approot": "/fixture/Sites/PNCB/worktrees/pncb-2026-merge",
    "strategy": "drupal-db",
    "scope": "current revisions, default language; placements and nested instances separate",
    "definitions": {
      "placements": "paragraphs whose immediate parent is a page-level host, plus blocks referenced by Layout Builder or block configuration; Site Studio components without a component ancestor in host layouts",
      "structuralRefs": "paragraphs whose immediate parent is another paragraph or block, plus blocks embedded through a paragraph block field; nested Site Studio components and stored reusable-content components (counted once, with published host pages attributed through references)"
    },
    "population": {
      "siteStudioLayouts": 0,
      "paragraphInstances": 2418,
      "blockContentEntities": 46,
      "nodes": 1622,
      "layoutBuilderSections": 0
    },
    "exampleVerification": {
      "baseUrl": "https://pncb-2026-merge.ddev.site",
      "pagesFetched": 77,
      "anonymous": true,
      "twigDebug": true
    }
  },
  "usage": {
    "block:basic": {
      "placements": 0,
      "structuralRefs": 0,
      "pages": 0,
      "unpublishedInstances": 0,
      "inlineBlockEntities": 0,
      "configPlacedBlocks": 0,
      "orphanInstances": 0,
      "examples": [],
      "noExampleReason": "no component-specific rendered marker was found on the DB-derived anonymous pages"
    },
    "block:betty_bot_nav_item": {
      "placements": 2,
      "structuralRefs": 0,
      "pages": 0,
      "unpublishedInstances": 0,
      "inlineBlockEntities": 0,
      "configPlacedBlocks": 2,
      "orphanInstances": 0,
      "examples": [],
      "noExampleReason": "no component-specific rendered marker was found on the DB-derived anonymous pages"
    },
    "block:contact_and_follow": {
      "placements": 2,
      "structuralRefs": 0,
      "pages": 0,
      "unpublishedInstances": 0,
      "inlineBlockEntities": 0,
      "configPlacedBlocks": 2,
      "orphanInstances": 0,
      "examples": [],
      "noExampleReason": "no component-specific rendered marker was found on the DB-derived anonymous pages"
    },
    "block:faces_of_certification": {
      "placements": 6,
      "structuralRefs": 0,
      "pages": 0,
      "unpublishedInstances": 0,
      "inlineBlockEntities": 0,
      "configPlacedBlocks": 6,
      "orphanInstances": 0,
      "examples": [],
      "noExampleReason": "no component-specific rendered marker was found on the DB-derived anonymous pages"
    },
    "block:footer_top_cta": {
      "placements": 6,
      "structuralRefs": 0,
      "pages": 0,
      "unpublishedInstances": 0,
      "inlineBlockEntities": 0,
      "configPlacedBlocks": 6,
      "orphanInstances": 0,
      "examples": [],
      "noExampleReason": "no component-specific rendered marker was found on the DB-derived anonymous pages"
    },
    "block:ipn_logo": {
      "placements": 2,
      "structuralRefs": 0,
      "pages": 0,
      "unpublishedInstances": 0,
      "inlineBlockEntities": 0,
      "configPlacedBlocks": 2,
      "orphanInstances": 0,
      "examples": [],
      "noExampleReason": "no component-specific rendered marker was found on the DB-derived anonymous pages"
    },
    "block:sidebar_promo": {
      "placements": 46,
      "structuralRefs": 0,
      "pages": 0,
      "unpublishedInstances": 0,
      "inlineBlockEntities": 0,
      "configPlacedBlocks": 46,
      "orphanInstances": 0,
      "examples": [],
      "noExampleReason": "no component-specific rendered marker was found on the DB-derived anonymous pages"
    },
    "block:site_copyright": {
      "placements": 2,
      "structuralRefs": 0,
      "pages": 0,
      "unpublishedInstances": 0,
      "inlineBlockEntities": 0,
      "configPlacedBlocks": 2,
      "orphanInstances": 0,
      "examples": [],
      "noExampleReason": "no component-specific rendered marker was found on the DB-derived anonymous pages"
    },
    "block:sitewide_alert": {
      "placements": 20,
      "structuralRefs": 0,
      "pages": 0,
      "unpublishedInstances": 0,
      "inlineBlockEntities": 0,
      "configPlacedBlocks": 20,
      "orphanInstances": 0,
      "examples": [],
      "noExampleReason": "no component-specific rendered marker was found on the DB-derived anonymous pages"
    },
    "paragraph:accordion": {
      "placements": 1,
      "structuralRefs": 57,
      "pages": 46,
      "unpublishedInstances": 0,
      "inlineBlockEntities": 0,
      "configPlacedBlocks": 0,
      "orphanInstances": 0,
      "examples": [
        {
          "url": "https://pncb-2026-merge.ddev.site/safeguarding-future-pediatric-care",
          "path": "/safeguarding-future-pediatric-care",
          "marker": "paragraph--accordion.html.twig",
          "markerKind": "template",
          "markerUniqueToThisComponent": true,
          "instancesOnPage": 1,
          "status": 200,
          "anonymous": true,
          "verifiedAt": "2026-10-06T20:23:40+00:00"
        },
        {
          "url": "https://pncb-2026-merge.ddev.site/pediatric-nurse-interviews",
          "path": "/pediatric-nurse-interviews",
          "marker": "paragraph--accordion.html.twig",
          "markerKind": "template",
          "markerUniqueToThisComponent": true,
          "instancesOnPage": 1,
          "status": 200,
          "anonymous": true,
          "verifiedAt": "2026-10-06T20:23:40+00:00"
        },
        {
          "url": "https://pncb-2026-merge.ddev.site/residency-success",
          "path": "/residency-success",
          "marker": "paragraph--accordion.html.twig",
          "markerKind": "template",
          "markerUniqueToThisComponent": true,
          "instancesOnPage": 1,
          "status": 200,
          "anonymous": true,
          "verifiedAt": "2026-10-06T20:23:40+00:00"
        }
      ],
      "noExampleReason": null
    },
    "paragraph:accordion_callout": {
      "placements": 0,
      "structuralRefs": 4,
      "pages": 2,
      "unpublishedInstances": 0,
      "inlineBlockEntities": 0,
      "configPlacedBlocks": 0,
      "orphanInstances": 0,
      "examples": [
        {
          "url": "https://pncb-2026-merge.ddev.site/cpn-exam-resources",
          "path": "/cpn-exam-resources",
          "marker": "paragraph--accordion-callout.html.twig",
          "markerKind": "template",
          "markerUniqueToThisComponent": true,
          "instancesOnPage": 1,
          "status": 200,
          "anonymous": true,
          "verifiedAt": "2026-10-06T20:23:40+00:00"
        }
      ],
      "noExampleReason": null
    },
    "paragraph:accordion_item": {
      "placements": 0,
      "structuralRefs": 397,
      "pages": 46,
      "unpublishedInstances": 0,
      "inlineBlockEntities": 0,
      "configPlacedBlocks": 0,
      "orphanInstances": 0,
      "examples": [
        {
          "url": "https://pncb-2026-merge.ddev.site/safeguarding-future-pediatric-care",
          "path": "/safeguarding-future-pediatric-care",
          "marker": "paragraph--accordion-item.html.twig",
          "markerKind": "template",
          "markerUniqueToThisComponent": true,
          "instancesOnPage": 11,
          "status": 200,
          "anonymous": true,
          "verifiedAt": "2026-10-06T20:23:40+00:00"
        },
        {
          "url": "https://pncb-2026-merge.ddev.site/pediatric-nurse-interviews",
          "path": "/pediatric-nurse-interviews",
          "marker": "paragraph--accordion-item.html.twig",
          "markerKind": "template",
          "markerUniqueToThisComponent": true,
          "instancesOnPage": 12,
          "status": 200,
          "anonymous": true,
          "verifiedAt": "2026-10-06T20:23:40+00:00"
        },
        {
          "url": "https://pncb-2026-merge.ddev.site/residency-success",
          "path": "/residency-success",
          "marker": "paragraph--accordion-item.html.twig",
          "markerKind": "template",
          "markerUniqueToThisComponent": true,
          "instancesOnPage": 5,
          "status": 200,
          "anonymous": true,
          "verifiedAt": "2026-10-06T20:23:40+00:00"
        }
      ],
      "noExampleReason": null
    },
    "paragraph:accordion_links": {
      "placements": 0,
      "structuralRefs": 7,
      "pages": 2,
      "unpublishedInstances": 0,
      "inlineBlockEntities": 0,
      "configPlacedBlocks": 0,
      "orphanInstances": 0,
      "examples": [
        {
          "url": "https://pncb-2026-merge.ddev.site/cpn-exam-resources",
          "path": "/cpn-exam-resources",
          "marker": "paragraph--accordion-links.html.twig",
          "markerKind": "template",
          "markerUniqueToThisComponent": true,
          "instancesOnPage": 1,
          "status": 200,
          "anonymous": true,
          "verifiedAt": "2026-10-06T20:23:40+00:00"
        }
      ],
      "noExampleReason": null
    },
    "paragraph:betty_bot": {
      "placements": 2,
      "structuralRefs": 0,
      "pages": 2,
      "unpublishedInstances": 0,
      "inlineBlockEntities": 0,
      "configPlacedBlocks": 0,
      "orphanInstances": 0,
      "examples": [
        {
          "url": "https://pncb-2026-merge.ddev.site/ask-pncbee",
          "path": "/ask-pncbee",
          "marker": "paragraph--betty-bot.html.twig",
          "markerKind": "template",
          "markerUniqueToThisComponent": true,
          "instancesOnPage": 1,
          "status": 200,
          "anonymous": true,
          "verifiedAt": "2026-10-06T20:23:40+00:00"
        }
      ],
      "noExampleReason": null
    },
    "paragraph:betty_bot_studyguide": {
      "placements": 0,
      "structuralRefs": 0,
      "pages": 0,
      "unpublishedInstances": 0,
      "inlineBlockEntities": 0,
      "configPlacedBlocks": 0,
      "orphanInstances": 0,
      "examples": [],